### ISSUE TITLE
ImageJ Java pva client flooding network with broadcasts on IOC disconnect

### ISSUE THREAD

**Issue by MarkRivers** [epics-base/pvAccessJava#16]
I observed a problem today where all of my vxWorks IOCs were 80-90% CPU busy.  The task using most of the time was one of the UDP-rx tasks.  

I then ran tcpdump on a Linux machine to capture broadcast messages.  

These are the first few packets of the capture
```
12:31:03.285068 IP camaro.cars.aps.anl.gov.51145 > 164.54.160.255.5076: UDP, length 1416
	0x0000:  4500 05a4 6778 0000 8011 4455 a436 a00f  E...gx....DU.6..
	0x0010:  a436 a0ff c7c9 13d4 0590 3ae4 ca01 8003  .6........:.....
	0x0020:  0000 0580 00e8 5c48 0000 0000 0000 0000  ......\H........
	0x0030:  0000 0000 0000 0000 0000 0000 c7c9 0103  ................
	0x0040:  7463 7000 3700 0012 ca14 3133 5049 4c31  tcp.7.....13PIL1
	0x0050:  4d53 693a 5076 6131 3a49 6d61 6765 0000  MSi:Pva1:Image..
	0x0060:  2621 1431 3350 494c 314d 5369 3a50 7661  &!.13PIL1MSi:Pva
	0x0070:  313a 496d 6167 6500 0026 2014 3133 5049  1:Image..&..13PI
	0x0080:  4c31 4d53 693a 5076 6131 3a49 6d61 6765  L1MSi:Pva1:Image
	0x0090:  0000 261f 1431 3350 494c 314d 5369 3a50  ..&..13PIL1MSi:P
	0x00a0:  7661 313a 496d 6167 6500 0026 1e14 3133  va1:Image..&..13
	0x00b0:  5049 4c31 4d53 693a 5076 6131 3a49 6d61  PIL1MSi:Pva1:Ima
	0x00c0:  6765 0000 261d 1431 3350 494c 314d 5369  ge..&..13PIL1MSi
	0x00d0:  3a50 7661 313a 496d 6167 6500 0026 1c14  :Pva1:Image..&..
	0x00e0:  3133 5049 4c31 4d53 693a 5076 6131 3a49  13PIL1MSi:Pva1:I
	0x00f0:  6d61 6765 0000 261b 1431 3350 494c 314d  mage..&..13PIL1M
	0x0100:  5369 3a50 7661 313a 496d 6167 6500 0026  Si:Pva1:Image..&
	0x0110:  1a14 3133 5049 4c31 4d53 693a 5076 6131  ..13PIL1MSi:Pva1
	0x0120:  3a49 6d61 6765 0000 2619 1431 3350 494c  :Image..&..13PIL
	0x0130:  314d 5369 3a50 7661 313a 496d 6167 6500  1MSi:Pva1:Image.
	0x0140:  0026 1814 3133 5049 4c31 4d53 693a 5076  .&..13PIL1MSi:Pv
	0x0150:  6131 3a49 6d61 6765 0000 2617 1431 3350  a1:Image..&..13P
	0x0160:  494c 314d 5369 3a50 7661 313a 496d 6167  IL1MSi:Pva1:Imag
	0x0170:  6500 0026 1614 3133 5049 4c31 4d53 693a  e..&..13PIL1MSi:
	0x0180:  5076 6131 3a49 6d61 6765 0000 2615 1431  Pva1:Image..&..1
	0x0190:  3350 494c 314d 5369 3a50 7661 313a 496d  3PIL1MSi:Pva1:Im
	0x01a0:  6167 6500 0026 1414 3133 5049 4c31 4d53  age..&..13PIL1MS
	0x01b0:  693a 5076 6131 3a49 6d61 6765 0000 2613  i:Pva1:Image..&.
	0x01c0:  1431 3350 494c 314d 5369 3a50 7661 313a  .13PIL1MSi:Pva1:
	0x01d0:  496d 6167 6500 0026 1214 3133 5049 4c31  Image..&..13PIL1
	0x01e0:  4d53 693a 5076 6131 3a49 6d61 6765 0000  MSi:Pva1:Image..
	0x01f0:  2611 1431 3350 494c 314d 5369 3a50 7661  &..13PIL1MSi:Pva
	0x0200:  313a 496d 6167 6500 0026 1014 3133 5049  1:Image..&..13PI
	0x0210:  4c31 4d53 693a 5076 6131 3a49 6d61 6765  L1MSi:Pva1:Image
	0x0220:  0000 260f 1431 3350 494c 314d 5369 3a50  ..&..13PIL1MSi:P
	0x0230:  7661 313a 496d 6167 6500 0026 0e14 3133  va1:Image..&..13
	0x0240:  5049 4c31 4d53 693a 5076 6131 3a49 6d61  PIL1MSi:Pva1:Ima
	0x0250:  6765 0000 260d 1431 3350 494c 314d 5369  ge..&..13PIL1MSi
	0x0260:  3a50 7661 313a 496d 6167 6500 0026 0c14  :Pva1:Image..&..
	0x0270:  3133 5049 4c31 4d53 693a 5076 6131 3a49  13PIL1MSi:Pva1:I
	0x0280:  6d61 6765 0000 260b 1431 3350 494c 314d  mage..&..13PIL1M
	0x0290:  5369 3a50 7661 313a 496d 6167 6500 0026  Si:Pva1:Image..&
	0x02a0:  0a14 3133 5049 4c31 4d53 693a 5076 6131  ..13PIL1MSi:Pva1
	0x02b0:  3a49 6d61 6765 0000 2609 1431 3350 494c  :Image..&..13PIL
	0x02c0:  314d 5369 3a50 7661 313a 496d 6167 6500  1MSi:Pva1:Image.
	0x02d0:  0026 0814 3133 5049 4c31 4d53 693a 5076  .&..13PIL1MSi:Pv
	0x02e0:  6131 3a49 6d61 6765 0000 2607 1431 3350  a1:Image..&..13P
	0x02f0:  494c 314d 5369 3a50 7661 313a 496d 6167  IL1MSi:Pva1:Imag
	0x0300:  6500 0026 0614 3133 5049 4c31 4d53 693a  e..&..13PIL1MSi:
	0x0310:  5076 6131 3a49 6d61 6765 0000 2605 1431  Pva1:Image..&..1
	0x0320:  3350 494c 314d 5369 3a50 7661 313a 496d  3PIL1MSi:Pva1:Im
	0x0330:  6167 6500 0026 0414 3133 5049 4c31 4d53  age..&..13PIL1MS
	0x0340:  693a 5076 6131 3a49 6d61 6765 0000 2603  i:Pva1:Image..&.
	0x0350:  1431 3350 494c 314d 5369 3a50 7661 313a  .13PIL1MSi:Pva1:
	0x0360:  496d 6167 6500 0026 0214 3133 5049 4c31  Image..&..13PIL1
	0x0370:  4d53 693a 5076 6131 3a49 6d61 6765 0000  MSi:Pva1:Image..
	0x0380:  2601 1431 3350 494c 314d 5369 3a50 7661  &..13PIL1MSi:Pva
	0x0390:  313a 496d 6167 6500 0026 0014 3133 5049  1:Image..&..13PI
	0x03a0:  4c31 4d53 693a 5076 6131 3a49 6d61 6765  L1MSi:Pva1:Image
	0x03b0:  0000 25ff 1431 3350 494c 314d 5369 3a50  ..%..13PIL1MSi:P
	0x03c0:  7661 313a 496d 6167 6500 0025 fe14 3133  va1:Image..%..13
	0x03d0:  5049 4c31 4d53 693a 5076 6131 3a49 6d61  PIL1MSi:Pva1:Ima
	0x03e0:  6765 0000 25fd 1431 3350 494c 314d 5369  ge..%..13PIL1MSi
	0x03f0:  3a50 7661 313a 496d 6167 6500 0025 fc14  :Pva1:Image..%..
	0x0400:  3133 5049 4c31 4d53 693a 5076 6131 3a49  13PIL1MSi:Pva1:I
	0x0410:  6d61 6765 0000 25fb 1431 3350 494c 314d  mage..%..13PIL1M
	0x0420:  5369 3a50 7661 313a 496d 6167 6500 0025  Si:Pva1:Image..%
	0x0430:  fa14 3133 5049 4c31 4d53 693a 5076 6131  ..13PIL1MSi:Pva1
	0x0440:  3a49 6d61 6765 0000 25f9 1431 3350 494c  :Image..%..13PIL
	0x0450:  314d 5369 3a50 7661 313a 496d 6167 6500  1MSi:Pva1:Image.
	0x0460:  0025 f814 3133 5049 4c31 4d53 693a 5076  .%..13PIL1MSi:Pv
	0x0470:  6131 3a49 6d61 6765 0000 25f7 1431 3350  a1:Image..%..13P
	0x0480:  494c 314d 5369 3a50 7661 313a 496d 6167  IL1MSi:Pva1:Imag
	0x0490:  6500 0025 f614 3133 5049 4c31 4d53 693a  e..%..13PIL1MSi:
	0x04a0:  5076 6131 3a49 6d61 6765 0000 25f5 1431  Pva1:Image..%..1
	0x04b0:  3350 494c 314d 5369 3a50 7661 313a 496d  3PIL1MSi:Pva1:Im
	0x04c0:  6167 6500 0025 f414 3133 5049 4c31 4d53  age..%..13PIL1MS
	0x04d0:  693a 5076 6131 3a49 6d61 6765 0000 25f3  i:Pva1:Image..%.
	0x04e0:  1431 3350 494c 314d 5369 3a50 7661 313a  .13PIL1MSi:Pva1:
	0x04f0:  496d 6167 6500 0025 f214 3133 5049 4c31  Image..%..13PIL1
	0x0500:  4d53 693a 5076 6131 3a49 6d61 6765 0000  MSi:Pva1:Image..
	0x0510:  25f1 1431 3350 494c 314d 5369 3a50 7661  %..13PIL1MSi:Pva
	0x0520:  313a 496d 6167 6500 0025 f014 3133 5049  1:Image..%..13PI
	0x0530:  4c31 4d53 693a 5076 6131 3a49 6d61 6765  L1MSi:Pva1:Image
	0x0540:  0000 25ef 1431 3350 494c 314d 5369 3a50  ..%..13PIL1MSi:P
	0x0550:  7661 313a 496d 6167 6500 0025 ee14 3133  va1:Image..%..13
	0x0560:  5049 4c31 4d53 693a 5076 6131 3a49 6d61  PIL1MSi:Pva1:Ima
	0x0570:  6765 0000 25ed 1431 3350 494c 314d 5369  ge..%..13PIL1MSi
	0x0580:  3a50 7661 313a 496d 6167 6500 0025 ec14  :Pva1:Image..%..
	0x0590:  3133 5049 4c31 4d53 693a 5076 6131 3a49  13PIL1MSi:Pva1:I
	0x05a0:  6d61 6765                                mage
12:31:03.285214 IP camaro.cars.aps.anl.gov.51145 > 164.54.160.255.5076: UDP, length 1416
	0x0000:  4500 05a4 6779 0000 8011 4454 a436 a00f  E...gy....DT.6..
	0x0010:  a436 a0ff c7c9 13d4 0590 eca2 ca01 8003  .6..............
	0x0020:  0000 0580 00e8 5c49 0000 0000 0000 0000  ......\I........
	0x0030:  0000 0000 0000 0000 0000 0000 c7c9 0103  ................
	0x0040:  7463 7000 3700 0025 eb14 3133 5049 4c31  tcp.7..%..13PIL1
	0x0050:  4d53 693a 5076 6131 3a49 6d61 6765 0000  MSi:Pva1:Image..
	0x0060:  25ea 1431 3350 494c 314d 5369 3a50 7661  %..13PIL1MSi:Pva
	0x0070:  313a 496d 6167 6500 0025 e914 3133 5049  1:Image..%..13PI
	0x0080:  4c31 4d53 693a 5076 6131 3a49 6d61 6765  L1MSi:Pva1:Image
	0x0090:  0000 25e8 1431 3350 494c 314d 5369 3a50  ..%..13PIL1MSi:P
	0x00a0:  7661 313a 496d 6167 6500 0025 e714 3133  va1:Image..%..13
	0x00b0:  5049 4c31 4d53 693a 5076 6131 3a49 6d61  PIL1MSi:Pva1:Ima
	0x00c0:  6765 0000 25e6 1431 3350 494c 314d 5369  ge..%..13PIL1MSi
	0x00d0:  3a50 7661 313a 496d 6167 6500 0025 e514  :Pva1:Image..%..
	0x00e0:  3133 5049 4c31 4d53 693a 5076 6131 3a49  13PIL1MSi:Pva1:I
	0x00f0:  6d61 6765 0000 25e4 1431 3350 494c 314d  mage..%..13PIL1M
	0x0100:  5369 3a50 7661 313a 496d 6167 6500 0025  Si:Pva1:Image..%
	0x0110:  e314 3133 5049 4c31 4d53 693a 5076 6131  ..13PIL1MSi:Pva1
	0x0120:  3a49 6d61 6765 0000 25e2 1431 3350 494c  :Image..%..13PIL
	0x0130:  314d 5369 3a50 7661 313a 496d 6167 6500  1MSi:Pva1:Image.
	0x0140:  0025 e114 3133 5049 4c31 4d53 693a 5076  .%..13PIL1MSi:Pv
	0x0150:  6131 3a49 6d61 6765 0000 25e0 1431 3350  a1:Image..%..13P
	0x0160:  494c 314d 5369 3a50 7661 313a 496d 6167  IL1MSi:Pva1:Imag
	0x0170:  6500 0025 df14 3133 5049 4c31 4d53 693a  e..%..13PIL1MSi:
	0x0180:  5076 6131 3a49 6d61 6765 0000 25de 1431  Pva1:Image..%..1
	0x0190:  3350 494c 314d 5369 3a50 7661 313a 496d  3PIL1MSi:Pva1:Im
	0x01a0:  6167 6500 0025 dd14 3133 5049 4c31 4d53  age..%..13PIL1MS
	0x01b0:  693a 5076 6131 3a49 6d61 6765 0000 25dc  i:Pva1:Image..%.
	0x01c0:  1431 3350 494c 314d 5369 3a50 7661 313a  .13PIL1MSi:Pva1:
	0x01d0:  496d 6167 6500 0025 db14 3133 5049 4c31  Image..%..13PIL1
	0x01e0:  4d53 693a 5076 6131 3a49 6d61 6765 0000  MSi:Pva1:Image..
	0x01f0:  25da 1431 3350 494c 314d 5369 3a50 7661  %..13PIL1MSi:Pva
	0x0200:  313a 496d 6167 6500 0025 d914 3133 5049  1:Image..%..13PI
	0x0210:  4c31 4d53 693a 5076 6131 3a49 6d61 6765  L1MSi:Pva1:Image
	0x0220:  0000 25d8 1431 3350 494c 314d 5369 3a50  ..%..13PIL1MSi:P
	0x0230:  7661 313a 496d 6167 6500 0025 d714 3133  va1:Image..%..13
	0x0240:  5049 4c31 4d53 693a 5076 6131 3a49 6d61  PIL1MSi:Pva1:Ima
	0x0250:  6765 0000 25d6 1431 3350 494c 314d 5369  ge..%..13PIL1MSi
	0x0260:  3a50 7661 313a 496d 6167 6500 0025 d514  :Pva1:Image..%..
	0x0270:  3133 5049 4c31 4d53 693a 5076 6131 3a49  13PIL1MSi:Pva1:I
	0x0280:  6d61 6765 0000 25d4 1431 3350 494c 314d  mage..%..13PIL1M
	0x0290:  5369 3a50 7661 313a 496d 6167 6500 0025  Si:Pva1:Image..%
	0x02a0:  d314 3133 5049 4c31 4d53 693a 5076 6131  ..13PIL1MSi:Pva1
	0x02b0:  3a49 6d61 6765 0000 25d2 1431 3350 494c  :Image..%..13PIL
	0x02c0:  314d 5369 3a50 7661 313a 496d 6167 6500  1MSi:Pva1:Image.
	0x02d0:  0025 d114 3133 5049 4c31 4d53 693a 5076  .%..13PIL1MSi:Pv
	0x02e0:  6131 3a49 6d61 6765 0000 25d0 1431 3350  a1:Image..%..13P
	0x02f0:  494c 314d 5369 3a50 7661 313a 496d 6167  IL1MSi:Pva1:Imag
	0x0300:  6500 0025 cf14 3133 5049 4c31 4d53 693a  e..%..13PIL1MSi:
	0x0310:  5076 6131 3a49 6d61 6765 0000 25ce 1431  Pva1:Image..%..1
	0x0320:  3350 494c 314d 5369 3a50 7661 313a 496d  3PIL1MSi:Pva1:Im
	0x0330:  6167 6500 0025 cd14 3133 5049 4c31 4d53  age..%..13PIL1MS
	0x0340:  693a 5076 6131 3a49 6d61 6765 0000 25cc  i:Pva1:Image..%.
	0x0350:  1431 3350 494c 314d 5369 3a50 7661 313a  .13PIL1MSi:Pva1:
	0x0360:  496d 6167 6500 0025 cb14 3133 5049 4c31  Image..%..13PIL1
	0x0370:  4d53 693a 5076 6131 3a49 6d61 6765 0000  MSi:Pva1:Image..
	0x0380:  25ca 1431 3350 494c 314d 5369 3a50 7661  %..13PIL1MSi:Pva
	0x0390:  313a 496d 6167 6500 0025 c914 3133 5049  1:Image..%..13PI
	0x03a0:  4c31 4d53 693a 5076 6131 3a49 6d61 6765  L1MSi:Pva1:Image
	0x03b0:  0000 25c8 1431 3350 494c 314d 5369 3a50  ..%..13PIL1MSi:P
	0x03c0:  7661 313a 496d 6167 6500 0025 c714 3133  va1:Image..%..13
	0x03d0:  5049 4c31 4d53 693a 5076 6131 3a49 6d61  PIL1MSi:Pva1:Ima
	0x03e0:  6765 0000 25c6 1431 3350 494c 314d 5369  ge..%..13PIL1MSi
	0x03f0:  3a50 7661 313a 496d 6167 6500 0025 c514  :Pva1:Image..%..
	0x0400:  3133 5049 4c31 4d53 693a 5076 6131 3a49  13PIL1MSi:Pva1:I
	0x0410:  6d61 6765 0000 25c4 1431 3350 494c 314d  mage..%..13PIL1M
	0x0420:  5369 3a50 7661 313a 496d 6167 6500 0025  Si:Pva1:Image..%
	0x0430:  c314 3133 5049 4c31 4d53 693a 5076 6131  ..13PIL1MSi:Pva1
	0x0440:  3a49 6d61 6765 0000 25c2 1431 3350 494c  :Image..%..13PIL
	0x0450:  314d 5369 3a50 7661 313a 496d 6167 6500  1MSi:Pva1:Image.
	0x0460:  0025 c114 3133 5049 4c31 4d53 693a 5076  .%..13PIL1MSi:Pv
	0x0470:  6131 3a49 6d61 6765 0000 25c0 1431 3350  a1:Image..%..13P
	0x0480:  494c 314d 5369 3a50 7661 313a 496d 6167  IL1MSi:Pva1:Imag
	0x0490:  6500 0025 bf14 3133 5049 4c31 4d53 693a  e..%..13PIL1MSi:
	0x04a0:  5076 6131 3a49 6d61 6765 0000 25be 1431  Pva1:Image..%..1
	0x04b0:  3350 494c 314d 5369 3a50 7661 313a 496d  3PIL1MSi:Pva1:Im
	0x04c0:  6167 6500 0025 bd14 3133 5049 4c31 4d53  age..%..13PIL1MS
	0x04d0:  693a 5076 6131 3a49 6d61 6765 0000 25bc  i:Pva1:Image..%.
	0x04e0:  1431 3350 494c 314d 5369 3a50 7661 313a  .13PIL1MSi:Pva1:
	0x04f0:  496d 6167 6500 0025 bb14 3133 5049 4c31  Image..%..13PIL1
	0x0500:  4d53 693a 5076 6131 3a49 6d61 6765 0000  MSi:Pva1:Image..
	0x0510:  25ba 1431 3350 494c 314d 5369 3a50 7661  %..13PIL1MSi:Pva
	0x0520:  313a 496d 6167 6500 0025 b914 3133 5049  1:Image..%..13PI
	0x0530:  4c31 4d53 693a 5076 6131 3a49 6d61 6765  L1MSi:Pva1:Image
	0x0540:  0000 25b8 1431 3350 494c 314d 5369 3a50  ..%..13PIL1MSi:P
	0x0550:  7661 313a 496d 6167 6500 0025 b714 3133  va1:Image..%..13
	0x0560:  5049 4c31 4d53 693a 5076 6131 3a49 6d61  PIL1MSi:Pva1:Ima
	0x0570:  6765 0000 25b6 1431 3350 494c 314d 5369  ge..%..13PIL1MSi
	0x0580:  3a50 7661 313a 496d 6167 6500 0025 b514  :Pva1:Image..%..
	0x0590:  3133 5049 4c31 4d53 693a 5076 6131 3a49  13PIL1MSi:Pva1:I
	0x05a0:  6d61 6765                                mage
12:31:03.285388 IP camaro.cars.aps.anl.gov.51145 > 164.54.160.255.5076: UDP, length 1416
	0x0000:  4500 05a4 677a 0000 8011 4453 a436 a00f  E...gz....DS.6..
	0x0010:  a436 a0ff c7c9 13d4 0590 f674 ca01 8003  .6.........t....
	0x0020:  0000 0580 00e8 5c4a 0000 0000 0000 0000  ......\J........
	0x0030:  0000 0000 0000 0000 0000 0000 c7c9 0103  ................
	0x0040:  7463 7000 3700 0025 b414 3133 5049 4c31  tcp.7..%..13PIL1
	0x0050:  4d53 693a 5076 6131 3a49 6d61 6765 0000  MSi:Pva1:Image..
	0x0060:  25b3 1431 3350 494c 314d 5369 3a50 7661  %..13PIL1MSi:Pva
	0x0070:  313a 496d 6167 6500 0025 b214 3133 5049  1:Image..%..13PI
	0x0080:  4c31 4d53 693a 5076 6131 3a49 6d61 6765  L1MSi:Pva1:Image
	0x0090:  0000 25b1 1431 3350 494c 314d 5369 3a50  ..%..13PIL1MSi:P
	0x00a0:  7661 313a 496d 6167 6500 0025 b014 3133  va1:Image..%..13
	0x00b0:  5049 4c31 4d53 693a 5076 6131 3a49 6d61  PIL1MSi:Pva1:Ima
	0x00c0:  6765 0000 25af 1431 3350 494c 314d 5369  ge..%..13PIL1MSi
	0x00d0:  3a50 7661 313a 496d 6167 6500 0025 ae14  :Pva1:Image..%..
	0x00e0:  3133 5049 4c31 4d53 693a 5076 6131 3a49  13PIL1MSi:Pva1:I
	0x00f0:  6d61 6765 0000 25ad 1431 3350 494c 314d  mage..%..13PIL1M
	0x0100:  5369 3a50 7661 313a 496d 6167 6500 0025  Si:Pva1:Image..%
	0x0110:  ac14 3133 5049 4c31 4d53 693a 5076 6131  ..13PIL1MSi:Pva1
	0x0120:  3a49 6d61 6765 0000 25ab 1431 3350 494c  :Image..%..13PIL
	0x0130:  314d 5369 3a50 7661 313a 496d 6167 6500  1MSi:Pva1:Image.
	0x0140:  0025 aa14 3133 5049 4c31 4d53 693a 5076  .%..13PIL1MSi:Pv
	0x0150:  6131 3a49 6d61 6765 0000 25a9 1431 3350  a1:Image..%..13P
	0x0160:  494c 314d 5369 3a50 7661 313a 496d 6167  IL1MSi:Pva1:Imag
	0x0170:  6500 0025 a814 3133 5049 4c31 4d53 693a  e..%..13PIL1MSi:
	0x0180:  5076 6131 3a49 6d61 6765 0000 25a7 1431  Pva1:Image..%..1
	0x0190:  3350 494c 314d 5369 3a50 7661 313a 496d  3PIL1MSi:Pva1:Im
	0x01a0:  6167 6500 0025 a614 3133 5049 4c31 4d53  age..%..13PIL1MS
	0x01b0:  693a 5076 6131 3a49 6d61 6765 0000 25a5  i:Pva1:Image..%.
	0x01c0:  1431 3350 494c 314d 5369 3a50 7661 313a  .13PIL1MSi:Pva1:
	0x01d0:  496d 6167 6500 0025 a414 3133 5049 4c31  Image..%..13PIL1
	0x01e0:  4d53 693a 5076 6131 3a49 6d61 6765 0000  MSi:Pva1:Image..
	0x01f0:  25a3 1431 3350 494c 314d 5369 3a50 7661  %..13PIL1MSi:Pva
	0x0200:  313a 496d 6167 6500 0025 a214 3133 5049  1:Image..%..13PI
	0x0210:  4c31 4d53 693a 5076 6131 3a49 6d61 6765  L1MSi:Pva1:Image
	0x0220:  0000 25a1 1431 3350 494c 314d 5369 3a50  ..%..13PIL1MSi:P
	0x0230:  7661 313a 496d 6167 6500 0025 a014 3133  va1:Image..%..13
	0x0240:  5049 4c31 4d53 693a 5076 6131 3a49 6d61  PIL1MSi:Pva1:Ima
	0x0250:  6765 0000 259f 1431 3350 494c 314d 5369  ge..%..13PIL1MSi
	0x0260:  3a50 7661 313a 496d 6167 6500 0025 9e14  :Pva1:Image..%..
	0x0270:  3133 5049 4c31 4d53 693a 5076 6131 3a49  13PIL1MSi:Pva1:I
	0x0280:  6d61 6765 0000 259d 1431 3350 494c 314d  mage..%..13PIL1M
	0x0290:  5369 3a50 7661 313a 496d 6167 6500 0025  Si:Pva1:Image..%
	0x02a0:  9c14 3133 5049 4c31 4d53 693a 5076 6131  ..13PIL1MSi:Pva1
	0x02b0:  3a49 6d61 6765 0000 259b 1431 3350 494c  :Image..%..13PIL
	0x02c0:  314d 5369 3a50 7661 313a 496d 6167 6500  1MSi:Pva1:Image.
	0x02d0:  0025 9a14 3133 5049 4c31 4d53 693a 5076  .%..13PIL1MSi:Pv
	0x02e0:  6131 3a49 6d61 6765 0000 2599 1431 3350  a1:Image..%..13P
	0x02f0:  494c 314d 5369 3a50 7661 313a 496d 6167  IL1MSi:Pva1:Imag
	0x0300:  6500 0025 9814 3133 5049 4c31 4d53 693a  e..%..13PIL1MSi:
	0x0310:  5076 6131 3a49 6d61 6765 0000 2597 1431  Pva1:Image..%..1
	0x0320:  3350 494c 314d 5369 3a50 7661 313a 496d  3PIL1MSi:Pva1:Im
	0x0330:  6167 6500 0025 9614 3133 5049 4c31 4d53  age..%..13PIL1MS
	0x0340:  693a 5076 6131 3a49 6d61 6765 0000 2595  i:Pva1:Image..%.
	0x0350:  1431 3350 494c 314d 5369 3a50 7661 313a  .13PIL1MSi:Pva1:
	0x0360:  496d 6167 6500 0025 9414 3133 5049 4c31  Image..%..13PIL1
	0x0370:  4d53 693a 5076 6131 3a49 6d61 6765 0000  MSi:Pva1:Image..
	0x0380:  2593 1431 3350 494c 314d 5369 3a50 7661  %..13PIL1MSi:Pva
	0x0390:  313a 496d 6167 6500 0025 9214 3133 5049  1:Image..%..13PI
	0x03a0:  4c31 4d53 693a 5076 6131 3a49 6d61 6765  L1MSi:Pva1:Image
	0x03b0:  0000 2591 1431 3350 494c 314d 5369 3a50  ..%..13PIL1MSi:P
	0x03c0:  7661 313a 496d 6167 6500 0025 9014 3133  va1:Image..%..13
	0x03d0:  5049 4c31 4d53 693a 5076 6131 3a49 6d61  PIL1MSi:Pva1:Ima
	0x03e0:  6765 0000 258f 1431 3350 494c 314d 5369  ge..%..13PIL1MSi
	0x03f0:  3a50 7661 313a 496d 6167 6500 0025 8e14  :Pva1:Image..%..
	0x0400:  3133 5049 4c31 4d53 693a 5076 6131 3a49  13PIL1MSi:Pva1:I
	0x0410:  6d61 6765 0000 258d 1431 3350 494c 314d  mage..%..13PIL1M
	0x0420:  5369 3a50 7661 313a 496d 6167 6500 0025  Si:Pva1:Image..%
	0x0430:  8c14 3133 5049 4c31 4d53 693a 5076 6131  ..13PIL1MSi:Pva1
	0x0440:  3a49 6d61 6765 0000 258b 1431 3350 494c  :Image..%..13PIL
	0x0450:  314d 5369 3a50 7661 313a 496d 6167 6500  1MSi:Pva1:Image.
	0x0460:  0025 8a14 3133 5049 4c31 4d53 693a 5076  .%..13PIL1MSi:Pv
	0x0470:  6131 3a49 6d61 6765 0000 2589 1431 3350  a1:Image..%..13P
	0x0480:  494c 314d 5369 3a50 7661 313a 496d 6167  IL1MSi:Pva1:Imag
	0x0490:  6500 0025 8814 3133 5049 4c31 4d53 693a  e..%..13PIL1MSi:
	0x04a0:  5076 6131 3a49 6d61 6765 0000 2587 1431  Pva1:Image..%..1
	0x04b0:  3350 494c 314d 5369 3a50 7661 313a 496d  3PIL1MSi:Pva1:Im
	0x04c0:  6167 6500 0025 8614 3133 5049 4c31 4d53  age..%..13PIL1MS
	0x04d0:  693a 5076 6131 3a49 6d61 6765 0000 2585  i:Pva1:Image..%.
	0x04e0:  1431 3350 494c 314d 5369 3a50 7661 313a  .13PIL1MSi:Pva1:
	0x04f0:  496d 6167 6500 0025 8414 3133 5049 4c31  Image..%..13PIL1
	0x0500:  4d53 693a 5076 6131 3a49 6d61 6765 0000  MSi:Pva1:Image..
	0x0510:  2583 1431 3350 494c 314d 5369 3a50 7661  %..13PIL1MSi:Pva
	0x0520:  313a 496d 6167 6500 0025 8214 3133 5049  1:Image..%..13PI
	0x0530:  4c31 4d53 693a 5076 6131 3a49 6d61 6765  L1MSi:Pva1:Image
	0x0540:  0000 2581 1431 3350 494c 314d 5369 3a50  ..%..13PIL1MSi:P
	0x0550:  7661 313a 496d 6167 6500 0025 8014 3133  va1:Image..%..13
	0x0560:  5049 4c31 4d53 693a 5076 6131 3a49 6d61  PIL1MSi:Pva1:Ima
	0x0570:  6765 0000 257f 1431 3350 494c 314d 5369  ge..%..13PIL1MSi
	0x0580:  3a50 7661 313a 496d 6167 6500 0025 7e14  :Pva1:Image..%~.
	0x0590:  3133 5049 4c31 4d53 693a 5076 6131 3a49  13PIL1MSi:Pva1:I
	0x05a0:  6d61 6765                                mage
12:31:03.285548 IP camaro.cars.aps.anl.gov.51145 > 164.54.160.255.5076: UDP, length 1416
	0x0000:  4500 05a4 677b 0000 8011 4452 a436 a00f  E...g{....DR.6..
```

So the machine camaro is broadcasting 1416 byte packets every 150 microseconds or so.  camaro is my Windows 7 desktop.  It was running ImageJ with the NTNDA_Viewer.java plugin.  It had been connected to an IOC with the areaDetector NDPluginPva server, which is serving the NTNDArray 13PIL1MSi:Pva1:Image.  That IOC computer was shut down yesterday afternoon, and sometime later the ImageJ Java PVA client began this broadcast storm.  This is obviously a bad thing, since it brought down all of my vxWorks IOCs.

The IOC is running the 7.0 branch of base, commit d77a96d23d962f996f12e29255aa29beed64c1b1 from June 27, 2018.

The ImageJ client is running:
```
-rw-rw-r-- 1 epics domain users   84561 Apr 13  2017 epics-ntypes-0.2.2.jar
-rw-rw-r-- 1 epics domain users  475935 Apr 13  2017 epics-pvaccess-5.0.2.jar
-rw-rw-r-- 1 epics domain users   86767 Apr 13  2017 epics-pvaclient-4.2.2.jar
-rw-rw-r-- 1 epics domain users  294869 Apr 13  2017 epics-pvdata-6.0.2.jar
-rw-rw-r-- 1 epics domain users   53587 Apr 13  2017 epics-pvdatabase-4.2.2.jar
```

I have not yet tried to reproduce the problem.

**Comment by shroffk** [comment]
Thanks for reporting this... 
@mrkraimer Do you have an idea what would cause this?

**Comment by MarkRivers** [comment]
Hi Kunal,
I created this issue here first, but I think this is the wrong location.  I then created it here:
https://github.com/epics-base/epicsCoreJava/issues/22

You should probably post your comment there are well, and then I will close this issue.

**Comment by mrkraimer** [comment]
On 09/11/2018 04:55 PM, Kunal Shroff wrote:
>
> Thanks for reporting this...
> @mrkraimer <https://github.com/mrkraimer> Do you have an idea what 
> would cause this?
>

No except that it could be a bug in the client side of pva server in 
pvAccessJava.
I did not write this code so I have no quick answer.
Might be a good idea to compare the Java implementation with the latest 
CPP implementation.

**Comment by mdavidsaver** [comment]
I can add to this a problem with beacon anomaly detection.  I observe the search retry time being reset after each beacon at a 15 sec interval.  This is with pvAccessJava 4.1.3 (cs-studio 4.3.3b).  I don't see any duplication in the searches so far though.

I've also noticed that after ~3 min. my (c++) server stops sending beacons at the 15 second interval, switching to a 180 seconds (3 min.) interval.  This would cause problems even if the beacon anomaly detection was working properly.

**Comment by mdavidsaver** [comment]
> switching to a 180 seconds (3 min.) interval.

I might have known... This is intentional.  https://github.com/epics-base/pvAccessCPP/blob/31261cee24754fd8f1cc2438d2947b535185cd85/src/server/beaconEmitter.cpp#L122

From the look of it, the c++ client beacon tracking only notices new servers, and doesn't try to detect time glitches at all.

**Comment by mdavidsaver** [comment]
Seems I've been talking to myself...

https://github.com/epics-base/epicsCoreJava/issues/22

**Comment by MarkRivers** [comment]
This issues was moved to 
https://github.com/epics-base/epicsCoreJava/issues/22

I am closing it here.
